{
  "schema_version": 1,
  "provider_id": "hakka_cert",
  "catalog_version": "exam-identity-v2",
  "facts": [
    {
      "id": "hakka-historical-grade-526-114-excel",
      "reviewed_at": "2026-10-09",
      "title": "114 年度客語能力認證初級題庫 ( 四縣腔 ) EXCEL下載",
      "source_url": "https://elearning.hakka.gov.tw/hakka/files/downloads/526.ods",
      "subject_code": "526-114-excel",
      "checksum": "1c9fa2924f4f0079ed0ac3d79e4c27faa9f7dbea1ad0d7cf9c6777efa7c00111",
      "edition_year_ad": 2025,
      "dialect_code": "sixian",
      "level_id": "basic-elementary",
      "matching_source_url": "https://elearning.hakka.gov.tw/hakka/files/downloads/678.ods",
      "matching_title": "114 年度客語能力認證基礎級暨初級題庫（四縣腔）EXCEL 下載",
      "matching_checksum": "1c9fa2924f4f0079ed0ac3d79e4c27faa9f7dbea1ad0d7cf9c6777efa7c00111",
      "matching_subject_code": "678-114-excel",
      "reason": "The immutable elementary-only source label refers to exactly the same SHA-256 ODS payload as the same-edition, same-dialect official shared basic/elementary bank. The corrected current official title and the 2023 shared-paper framework establish grade coverage; the old source label remains conserved.",
      "evidence_url": "https://elearning.hakka.gov.tw/hakka/download-files?c=2"
    },
    {
      "id": "hakka-historical-grade-529-114-excel",
      "reviewed_at": "2026-10-09",
      "title": "114 年度客語能力認證初級題庫 ( 海陸腔 ) EXCEL下載",
      "source_url": "https://elearning.hakka.gov.tw/hakka/files/downloads/529.ods",
      "subject_code": "529-114-excel",
      "checksum": "0262708f7f84272df4f00245648c17a21b8b486e61676d388cafcf2756cd410f",
      "edition_year_ad": 2025,
      "dialect_code": "hailu",
      "level_id": "basic-elementary",
      "matching_source_url": "https://elearning.hakka.gov.tw/hakka/files/downloads/684.ods",
      "matching_title": "114 年度客語能力認證基礎級暨初級題庫（海陸腔）EXCEL 下載",
      "matching_checksum": "0262708f7f84272df4f00245648c17a21b8b486e61676d388cafcf2756cd410f",
      "matching_subject_code": "684-114-excel",
      "reason": "The immutable elementary-only source label refers to exactly the same SHA-256 ODS payload as the same-edition, same-dialect official shared basic/elementary bank. The corrected current official title and the 2023 shared-paper framework establish grade coverage; the old source label remains conserved.",
      "evidence_url": "https://elearning.hakka.gov.tw/hakka/download-files?c=2"
    },
    {
      "id": "hakka-historical-grade-532-114-excel",
      "reviewed_at": "2026-10-09",
      "title": "114 年度客語能力認證初級題庫 ( 大埔腔 ) EXCEL下載",
      "source_url": "https://elearning.hakka.gov.tw/hakka/files/downloads/532.ods",
      "subject_code": "532-114-excel",
      "checksum": "80f00752fd0ff5a0bdfd21188afe25f2b55305f91f94645ec239758e4605b452",
      "edition_year_ad": 2025,
      "dialect_code": "dapu",
      "level_id": "basic-elementary",
      "matching_source_url": "https://elearning.hakka.gov.tw/hakka/files/downloads/690.ods",
      "matching_title": "114 年度客語能力認證基礎級暨初級題庫（大埔腔）EXCEL 下載",
      "matching_checksum": "80f00752fd0ff5a0bdfd21188afe25f2b55305f91f94645ec239758e4605b452",
      "matching_subject_code": "690-114-excel",
      "reason": "The immutable elementary-only source label refers to exactly the same SHA-256 ODS payload as the same-edition, same-dialect official shared basic/elementary bank. The corrected current official title and the 2023 shared-paper framework establish grade coverage; the old source label remains conserved.",
      "evidence_url": "https://elearning.hakka.gov.tw/hakka/download-files?c=2"
    },
    {
      "id": "hakka-historical-grade-535-114-excel",
      "reviewed_at": "2026-10-09",
      "title": "114 年度客語能力認證初級題庫 ( 饒平腔 ) EXCEL下載",
      "source_url": "https://elearning.hakka.gov.tw/hakka/files/downloads/535.ods",
      "subject_code": "535-114-excel",
      "checksum": "9dd66fd234b04176526df65da0a61ba6104f15e7bd0c4c2f5665e7b4cfebebd4",
      "edition_year_ad": 2025,
      "dialect_code": "raoping",
      "level_id": "basic-elementary",
      "matching_source_url": "https://elearning.hakka.gov.tw/hakka/files/downloads/696.ods",
      "matching_title": "114 年度客語能力認證基礎級暨初級題庫（饒平腔）EXCEL 下載",
      "matching_checksum": "9dd66fd234b04176526df65da0a61ba6104f15e7bd0c4c2f5665e7b4cfebebd4",
      "matching_subject_code": "696-114-excel",
      "reason": "The immutable elementary-only source label refers to exactly the same SHA-256 ODS payload as the same-edition, same-dialect official shared basic/elementary bank. The corrected current official title and the 2023 shared-paper framework establish grade coverage; the old source label remains conserved.",
      "evidence_url": "https://elearning.hakka.gov.tw/hakka/download-files?c=2"
    },
    {
      "id": "hakka-historical-grade-538-114-excel",
      "reviewed_at": "2026-10-09",
      "title": "114 年度客語能力認證初級題庫 ( 詔安腔 ) EXCEL下載",
      "source_url": "https://elearning.hakka.gov.tw/hakka/files/downloads/538.ods",
      "subject_code": "538-114-excel",
      "checksum": "7da4c36a3a3b8b43ad6b736801e95f56238808a4068c5600003b49a37eddf985",
      "edition_year_ad": 2025,
      "dialect_code": "zhaoan",
      "level_id": "basic-elementary",
      "matching_source_url": "https://elearning.hakka.gov.tw/hakka/files/downloads/702.ods",
      "matching_title": "114 年度客語能力認證基礎級暨初級題庫（詔安腔）EXCEL 下載",
      "matching_checksum": "7da4c36a3a3b8b43ad6b736801e95f56238808a4068c5600003b49a37eddf985",
      "matching_subject_code": "702-114-excel",
      "reason": "The immutable elementary-only source label refers to exactly the same SHA-256 ODS payload as the same-edition, same-dialect official shared basic/elementary bank. The corrected current official title and the 2023 shared-paper framework establish grade coverage; the old source label remains conserved.",
      "evidence_url": "https://elearning.hakka.gov.tw/hakka/download-files?c=2"
    },
    {
      "id": "hakka-historical-grade-616-115-excel",
      "reviewed_at": "2026-10-09",
      "title": "115 年度客語能力認證初級題庫 ( 詔安腔 ) EXCEL下載",
      "source_url": "https://elearning.hakka.gov.tw/hakka/files/downloads/616.ods",
      "subject_code": "616-115-excel",
      "checksum": "3967d9d43c41d7162a4d5371f900bcf1b3522d8df9ba6b2f856c671d2821873e",
      "edition_year_ad": 2026,
      "dialect_code": "zhaoan",
      "level_id": "basic-elementary",
      "matching_source_url": "https://elearning.hakka.gov.tw/hakka/files/downloads/787.ods",
      "matching_title": "115 年度客語能力認證基礎級暨初級題庫（詔安腔）EXCEL 下載",
      "matching_checksum": "8de40383c799f3cced01da2b13814fb307834d5c538784c825e8af54d8c229f2",
      "matching_subject_code": "787-115-excel",
      "reason": "The six retained bank worksheets have identical nonempty text and cell column positions to the same-edition, same-dialect official shared basic/elementary bank after whitespace/paragraph formatting is normalized and repeated columns are expanded. The old workbook also contains an obsolete linked authoring-settings sheet. Current official labels, native paired PDF covers and the 2023 shared-paper framework establish grade coverage. Both differing payload revisions remain conserved; they are not byte duplicates.",
      "evidence_url": "https://elearning.hakka.gov.tw/hakka/download-files?c=2"
    },
    {
      "id": "hakka-historical-grade-609-115-excel",
      "reviewed_at": "2026-10-09",
      "title": "115 年度客語能力認證初級題庫 ( 饒平腔 ) EXCEL下載",
      "source_url": "https://elearning.hakka.gov.tw/hakka/files/downloads/609.ods",
      "subject_code": "609-115-excel",
      "checksum": "7e30d72a81565d39cd913cf8aebbf402a5e8c4481a145d32e0dbbd74de4f5562",
      "edition_year_ad": 2026,
      "dialect_code": "raoping",
      "level_id": "basic-elementary",
      "matching_source_url": "https://elearning.hakka.gov.tw/hakka/files/downloads/781.ods",
      "matching_title": "115 年度客語能力認證基礎級暨初級題庫（饒平腔）EXCEL 下載",
      "matching_checksum": "153aee07e936493b2ca30d62e7962d8a03b653800fea6e7a3943807bdba47b1a",
      "matching_subject_code": "781-115-excel",
      "reason": "The six retained bank worksheets have identical nonempty text and cell column positions to the same-edition, same-dialect official shared basic/elementary bank after whitespace/paragraph formatting is normalized and repeated columns are expanded. The old workbook also contains an obsolete linked authoring-settings sheet. Current official labels, native paired PDF covers and the 2023 shared-paper framework establish grade coverage. Both differing payload revisions remain conserved; they are not byte duplicates.",
      "evidence_url": "https://elearning.hakka.gov.tw/hakka/download-files?c=2"
    },
    {
      "id": "hakka-historical-grade-602-115-excel",
      "reviewed_at": "2026-10-09",
      "title": "115 年度客語能力認證初級題庫 ( 大埔腔 ) EXCEL下載",
      "source_url": "https://elearning.hakka.gov.tw/hakka/files/downloads/602.ods",
      "subject_code": "602-115-excel",
      "checksum": "1320f29e249c38095de17d6da9a2da58e26f33f13790fd9803353dcc8d1e94cb",
      "edition_year_ad": 2026,
      "dialect_code": "dapu",
      "level_id": "basic-elementary",
      "matching_source_url": "https://elearning.hakka.gov.tw/hakka/files/downloads/775.ods",
      "matching_title": "115 年度客語能力認證基礎級暨初級題庫（大埔腔）EXCEL 下載",
      "matching_checksum": "1bb3a6cf8a13cab61d87a5398311d34a1447792de3e02c770789ab67a808c97e",
      "matching_subject_code": "775-115-excel",
      "reason": "The six retained bank worksheets have identical nonempty text and cell column positions to the same-edition, same-dialect official shared basic/elementary bank after whitespace/paragraph formatting is normalized and repeated columns are expanded. The old workbook also contains an obsolete linked authoring-settings sheet. Current official labels, native paired PDF covers and the 2023 shared-paper framework establish grade coverage. Both differing payload revisions remain conserved; they are not byte duplicates.",